product_id;video_link_github;title;price;product_link;availability;condition;description;image_link;additional_image_link;quantity_to_sell_on_facebook
"DPS-WP-20260509-1929-002";"https://raw.githubusercontent.com/Susderk/mockup-uploads/main/mockups/2026-05-09/Neon Blossom Path/Neon_Blossom_Path.mp4";"Neon Cyberpunk Cherry Blossom Desktop Wallpaper & Zoom Background 4K";"2,99";"";"in stock";"new";"Transform your workspace with this stunning Neon Cyberpunk Cherry Blossom Digital Download set. This 4K wallpaper bundle features 5 PNG images perfect for both desktop wallpaper and Zoom/Teams meeting backgrounds.

Each design combines vibrant neon rainbow spectrum glows with serene cherry blossoms arching over ancient stone pathways. The soft watercolor transitions and luminous bokeh blur create an ethereal yet modern aesthetic—ideal for bringing a touch of futuristic beauty to your home office or virtual meetings.

What's included:
• 5 high-resolution PNG files (4K quality)
• Instant Digital Download
• Ready to use on desktop, laptop, or as a video call background
• Works with Zoom, Microsoft Teams, Google Meet, and other platforms

Simply download, unzip, and set as your wallpaper or upload to your video conferencing software. No physical shipping—instant access to all files upon purchase.

This product was created using AI and manually curated.

💻 Get it now at digipicshop on Etsy: https://digipicshopdesigns.etsy.com — Use code NEWCUST50 for 50% off";"https://raw.githubusercontent.com/Susderk/mockup-uploads/main/mockups/2026-05-09/Neon Blossom Path/mockup_1.jpg";"https://raw.githubusercontent.com/Susderk/mockup-uploads/main/mockups/2026-05-09/Neon Blossom Path/mockup_2.jpg, https://raw.githubusercontent.com/Susderk/mockup-uploads/main/mockups/2026-05-09/Neon Blossom Path/mockup_3.jpg, https://raw.githubusercontent.com/Susderk/mockup-uploads/main/mockups/2026-05-09/Neon Blossom Path/mockup_4.jpg";"999"
"DPS-WP-20260510-2111-001";"";"Rooftop Observatory Winter Wallpaper | Ethereal Telescope 4K Desktop & Zoom Background";"2,99";"";"in stock";"new";"Discover this stunning ethereal rooftop observatory wallpaper set featuring hand-drawn sketch illustrations of telescopes pointing toward a star-filled winter solstice sky. This Digital Download includes 5 high-resolution PNG images in 4K, perfect for both desktop wallpaper and virtual meeting backgrounds.

Each image captures a mystical foggy dawn atmosphere with soft grayscale gradients and luminous haze. The monochromatic tonal palette creates atmospheric depth and drama, ideal for creating a serene yet inspiring workspace backdrop.

Use these images as your desktop wallpaper to transform your screen, or upload directly to Zoom, Teams, or any video conferencing platform as a professional meeting background. The ethereal aesthetic works beautifully in home offices, creative studios, and modern spaces.

Instant download—no waiting. Simply download, unzip, and use immediately across all your devices.

This product was created using AI and manually curated.

📩 Message me for a free installation guide – available in English, German, Spanish, and Portuguese for Windows, Mac, and Linux. @digipicshop";"";"";"999"
"DPS-WP-20260510-2111-002";"";"Summer Park Golden Hour Wallpaper Set | 4K Desktop & Zoom Background Bundle";"2,99";"";"in stock";"new";"Escape to a serene summer park at golden hour with this dreamy 5-image Digital Download wallpaper bundle. Each 4K PNG features vibrant street-art style landscapes with a soft, romantic atmosphere—muted teal and coral tones create an ethereal, painterly mood perfect for anyone seeking calm in their digital spaces.

What's included:
• 5 high-resolution PNG images (4K quality)
• Desktop wallpaper format
• Zoom/Teams background ready

Perfect for: home office decor, virtual meeting backdrops, personal computer screens, or aesthetic room displays. Simply download, save to your device, and set as your desktop wallpaper or upload to your video conferencing platform. Instant download—no shipping, no waiting.

This product was created using AI and manually curated.

📩 Message me for a free installation guide – available in English, German, Spanish, and Portuguese for Windows, Mac, and Linux. @digipicshop";"";"";"999"
"DPS-WP-20260511-2156-001";"";"Midnight Sun Nordic Wallpaper | 4K Desktop & Zoom Background Bundle";"2,99";"";"in stock";"new";"Bring serene Nordic beauty to your screen with this 5-image Digital Download wallpaper set. Each PNG is rendered in stunning 4K resolution, featuring ethereal midnight sun landscapes with soft grayscale gradients, luminous reflections, and atmospheric fog effects. The minimalist aesthetic and uplifting mood create a calming backdrop perfect for both your desktop and video calls. Simply download the files and set them as your device wallpaper or upload to Zoom, Teams, or any virtual meeting platform. Ideal for home office decor, creative professionals, and anyone seeking a tranquil, nature-inspired visual environment. No installation needed—instant download and ready to use.

This product was created using AI and manually curated.

📩 Message me for a free installation guide – available in English, German, Spanish, and Portuguese for Windows, Mac, and Linux. @digipicshop";"";"";"999"
"DPS-WP-20260511-2156-002";"";"Stone Circle Sunrise 4K Wallpaper & Zoom Background Bundle | Aerial Art";"2,99";"";"in stock";"new";"Discover this stunning 5 PNG Digital Download set featuring an aerial drone perspective of an ancient stone circle aligned with the rising summer sun at dawn. Each image is rendered in vibrant street-art style with sepia vintage tones and energetic neon light accents that create a luminous, atmospheric mood perfect for your home office or virtual meetings.

What You Get:
• 5 high-resolution PNG images in 4K quality
• Instant Download (no waiting, no shipping)
• Ready to use as desktop wallpaper or Zoom/Teams background

Perfect for creative professionals, history enthusiasts, and anyone seeking unique aesthetic decor. The blend of vintage warmth and modern neon energy brings an artistic, contemplative vibe to any screen. Simply download, extract, and set as your wallpaper or virtual meeting backdrop. Instant inspiration for your digital workspace.

This product was created using AI and manually curated.

📩 Message me for a free installation guide – available in English, German, Spanish, and Portuguese for Windows, Mac, and Linux. @digipicshop";"";"";"999"
